{
  "adapter": "ato_cli",
  "artifact_dir": "artifacts/runs/fda-start-1783546909",
  "checkpoint_id": "cp_01KX1ZXJQWRHHC586S6RTA3TYG",
  "commands": [
    {
      "command": [
        "ato",
        "work",
        "checkpoint",
        "--task",
        "fda-codex-cli-claude-code-current-ai-cli-20260708",
        "--run-id",
        "run_01KX1Z2T2Q63ZG69H5CWGD2E22",
        "--kind",
        "design",
        "--summary",
        "<redacted>",
        "--evidence-surface",
        "fda_artifact",
        "--evidence-id",
        "<redacted>",
        "--evidence-verdict",
        "pass",
        "--validation-status",
        "passed",
        "--freshness",
        "current",
        "--durability-class",
        "artifact",
        "--trust-level",
        "self_reported",
        "--json"
      ],
      "command_kind": "work_checkpoint",
      "exit_code": 0,
      "status": "succeeded",
      "stderr_summary": null,
      "stdout_json_detected": true,
      "stdout_top_level_keys": [
        "checkpoint",
        "evidence",
        "next_recommended_command"
      ]
    }
  ],
  "decision_mappings": [],
  "decision_sync": null,
  "evidence_edges": [
    {
      "evidence_id": "artifacts/runs/fda-start-1783546909/validation_report.json",
      "evidence_surface": "fda_artifact",
      "verdict": "pass"
    }
  ],
  "failure_reason": null,
  "raw_output_stored": false,
  "receipt_id": "ATO-FDA-DESIGN-001",
  "receipt_path": "artifacts/runs/fda-start-1783546909/ato_state_receipt.json",
  "resume_command": null,
  "run_id": "run_01KX1Z2T2Q63ZG69H5CWGD2E22",
  "schema_version": "fda.ato_state_receipt.v0",
  "stage": "design",
  "status": "succeeded",
  "task_key": "fda-codex-cli-claude-code-current-ai-cli-20260708"
}
